[
  {
    "testName": "BotPerformanceComparison_GameState162",
    "gameStateFile": "162.json",
    "testType": "MultiBotArray",
    "botNickname": "ClingyHeuroBot2",
    "acceptableActions": ["Up", "Down", "Left", "Right"],
    "bots": ["ClingyHeuroBot2", "ClingyHeuroBot"],
    "description": "Compare performance of both bots on complex game state"
  },
  {
    "testName": "LoadTest_GameState162",
    "gameStateFile": "162.json",
    "testType": "GameStateLoad",
    "description": "Validate that game state 162 loads without errors"
  },
  {
    "testName": "SingleBot_ExpectedUp_GameState162",
    "gameStateFile": "162.json",
    "testType": "SingleBot",
    "expectedAction": "Up",
    "description": "Test that single bot returns expected Up action on game state 162"
  }
] 