[
  {
    "testName": "GameState13ClingyHeuroBot2ShouldMoveRight",
    "gameStateFile": "13.json",
    "testType": "SingleBot",
    "botNickname": "ClingyHeuroBot2",
    "expectedAction": "Right",
    "description": "ClingyHeuroBot2 should move Right from (15,35) to access immediate pellet at (17,35)"
  },
  {
    "testName": "GameState13ClingyHeuroBot2PelletAnalysis",
    "gameStateFile": "13.json",
    "testType": "MultiBotArray",
    "botNickname": "ClingyHeuroBot2",
    "acceptableActions": ["Up", "Down", "Left", "Right"],
    "bots": ["ClingyHeuroBot2"],
    "description": "Analyze ClingyHeuroBot2's pellet detection in GameState 13 - should see immediate pellet Right"
  },
  {
    "testName": "GameState13LoadTest",
    "gameStateFile": "13.json",
    "testType": "GameStateLoad",
    "description": "Validate that GameState 13 loads without errors"
  }
] 